{
  "schemaVersion": "molit.profile-semantic-diff/1",
  "from": {
    "manifestSha256": "77dc454540da6e32db3e0724f620a3ca0afe1017e3193eae09c346fcc687486e",
    "version": "0.1.0"
  },
  "to": {
    "manifestSha256": "0666b7c2ed74800264a9ac6c8292f819fc973a02057397faca3b3d5df3bacfe4",
    "version": "1.0.0-rc.1"
  },
  "profileModules": {
    "conformance": {
      "added": [
        "dataspace-offering",
        "network",
        "observation",
        "quality"
      ],
      "from": [
        "core",
        "geo"
      ],
      "removed": [],
      "to": [
        "core",
        "dataspace-offering",
        "geo",
        "network",
        "observation",
        "quality"
      ]
    },
    "validationPolicy": {
      "from": [
        "core-publication",
        "geo-publication"
      ],
      "to": [
        "publication-policy"
      ]
    }
  },
  "requirements": {
    "added": [
      "MOLIT-AGENT-001-P-NAME-001",
      "MOLIT-CAT-001-P-DATASET-001",
      "MOLIT-CAT-001-P-DESCRIPTION-001",
      "MOLIT-CAT-001-P-LANGUAGE-001",
      "MOLIT-CAT-001-P-PUBLISHER-001",
      "MOLIT-CAT-001-P-RECORD-001",
      "MOLIT-CAT-001-P-TITLE-001",
      "MOLIT-CAT-REL-001",
      "MOLIT-CAT-REL-001-P-PATH-DA00F2B2F6-001",
      "MOLIT-CV-CHECKSUM-001-P-ALGORITHM-001",
      "MOLIT-CV-MEDIATYPE-001-P-COMPRESSFORMAT-001",
      "MOLIT-CV-MEDIATYPE-001-P-MEDIATYPE-001",
      "MOLIT-CV-MEDIATYPE-001-P-PACKAGEFORMAT-001",
      "MOLIT-CV-MEDIATYPE-001-P-TYPE-001",
      "MOLIT-DEPRECATED-LOCAL-001",
      "MOLIT-DS-001-P-ACCESSRIGHTS-001",
      "MOLIT-DS-001-P-DESCRIPTION-001",
      "MOLIT-DS-001-P-IDENTIFIER-001",
      "MOLIT-DS-001-P-ISSUED-001",
      "MOLIT-DS-001-P-MODIFIED-001",
      "MOLIT-DS-001-P-PATH-0E31B21B99-001",
      "MOLIT-DS-001-P-PATH-30F94DAB87-001",
      "MOLIT-DS-001-P-PUBLISHER-001",
      "MOLIT-DS-001-P-THEME-001",
      "MOLIT-DS-001-P-THEME-002",
      "MOLIT-DS-001-P-TITLE-001",
      "MOLIT-GEO-001-P-REFERENCESYSTEM-001",
      "MOLIT-GEO-001-P-SPATIALDISCLOSURELEVEL-001",
      "MOLIT-GEO-001-P-SPATIALRESOLUTIONINMETERS-001",
      "MOLIT-GEO-001-P-TYPE-001",
      "MOLIT-GEO-DISCLOSURE-001-P-SPATIALDISCLOSURELEVEL-001",
      "MOLIT-GEO-ENCODING-005-P-ASDGGS-001",
      "MOLIT-GEO-ENCODING-005-P-ASGEOJSON-001",
      "MOLIT-GEO-ENCODING-005-P-ASKML-001",
      "MOLIT-GEO-ENCODING-005-P-HASSERIALIZATION-001",
      "MOLIT-GEO-LINK-001-P-PATH-BFC98936CC-001",
      "MOLIT-GEO-LINK-002-P-PATH-D6567CFAEC-001",
      "MOLIT-GEO-PROFILE-001-P-CONFORMSTO-001",
      "MOLIT-GEO-PROFILE-002-P-CONFORMSTO-001",
      "MOLIT-GEO-TYPE-001",
      "MOLIT-GEO-TYPE-002",
      "MOLIT-GEO-TYPE-003",
      "MOLIT-GEO-TYPE-004",
      "MOLIT-NET-001-P-NETWORKREFERENCE-001",
      "MOLIT-NET-001-P-TRANSPORTMODE-001",
      "MOLIT-NET-001-P-TYPE-001",
      "MOLIT-NET-002-P-TYPE-001",
      "MOLIT-NET-REF-001-P-NETWORKAUTHORITY-001",
      "MOLIT-NET-REF-001-P-NETWORKELEMENTTYPE-001",
      "MOLIT-NET-REF-001-P-NETWORKIDENTIFIER-001",
      "MOLIT-NET-REF-001-P-NETWORKVERSION-001",
      "MOLIT-NET-REF-IRI-001",
      "MOLIT-NET-REPLACEMENT-001",
      "MOLIT-NET-SAMEAS-001",
      "MOLIT-NET-SAMEAS-001-P-INCOMING-001",
      "MOLIT-NET-SAMEAS-001-P-OUTGOING-001",
      "MOLIT-NET-SNAPSHOT-001",
      "MOLIT-NET-SNAPSHOT-001-P-NETWORKIDENTIFIER-001",
      "MOLIT-NET-SNAPSHOT-001-P-NETWORKLIFECYCLESTATUS-001",
      "MOLIT-NET-SNAPSHOT-001-P-NETWORKSNAPSHOTCHECKSUM-001",
      "MOLIT-NET-SNAPSHOT-001-P-NETWORKVALIDFROM-001",
      "MOLIT-NET-SNAPSHOT-001-P-NETWORKVALIDUNTIL-001",
      "MOLIT-NET-SNAPSHOT-001-P-NETWORKVERSION-001",
      "MOLIT-NET-VALIDITY-001",
      "MOLIT-NET-VALIDITY-001-P-NETWORKVALIDFROM-001",
      "MOLIT-OBS-001-P-AGGREGATIONPERIOD-001",
      "MOLIT-OBS-001-P-MISSINGVALUEPOLICY-001",
      "MOLIT-OBS-001-P-OBSERVATIONAGGREGATION-001",
      "MOLIT-OBS-001-P-OBSERVATIONSUBJECTTYPE-001",
      "MOLIT-OBS-001-P-OBSERVATIONUNIT-001",
      "MOLIT-OBS-001-P-OBSERVEDPROPERTY-001",
      "MOLIT-OBS-001-P-TEMPORAL-001",
      "MOLIT-OBS-001-P-TEMPORALRESOLUTION-001",
      "MOLIT-OBS-001-P-TYPE-001",
      "MOLIT-OBS-UNIT-001",
      "MOLIT-OFFER-001",
      "MOLIT-OFFER-001-P-DESCRIBESOFFERINGDATASET-001",
      "MOLIT-OFFER-001-P-IDENTIFIER-001",
      "MOLIT-OFFER-001-P-MODIFIED-001",
      "MOLIT-OFFER-001-P-OFFERINGREADINESSSTATUS-001",
      "MOLIT-OFFER-001-P-TITLE-001",
      "MOLIT-OFFER-LINK-001",
      "MOLIT-OFFER-LINK-001-P-DESCRIBESOFFERINGDATASET-001",
      "MOLIT-PROFILE-CORE-001-P-CONFORMSTO-001",
      "MOLIT-PROFILE-CORE-002-P-CONFORMSTO-001",
      "MOLIT-PROFILE-NET-001",
      "MOLIT-PROFILE-NET-001-P-CONFORMSTO-001",
      "MOLIT-PROFILE-NET-002",
      "MOLIT-PROFILE-NET-002-P-CONFORMSTO-001",
      "MOLIT-PROFILE-OBS-001",
      "MOLIT-PROFILE-OBS-001-P-CONFORMSTO-001",
      "MOLIT-PROFILE-OBS-002",
      "MOLIT-PROFILE-OBS-002-P-CONFORMSTO-001",
      "MOLIT-PROFILE-OFFER-001",
      "MOLIT-PROFILE-OFFER-001-P-CONFORMSTO-001",
      "MOLIT-PROFILE-OFFER-002",
      "MOLIT-PROFILE-OFFER-002-P-CONFORMSTO-001",
      "MOLIT-PROFILE-QUAL-001",
      "MOLIT-PROFILE-QUAL-001-P-CONFORMSTO-001",
      "MOLIT-PROFILE-QUAL-002",
      "MOLIT-PROFILE-QUAL-002-P-CONFORMSTO-001",
      "MOLIT-PROFILE-SELECTION-GEOSPARQL-001",
      "MOLIT-PROFILE-SELECTION-MARKER-001",
      "MOLIT-QUAL-001-P-QUALITYSTATUS-001",
      "MOLIT-QUAL-LINK-001",
      "MOLIT-QUAL-LINK-001-P-PATH-7CC75844D0-001",
      "MOLIT-QUAL-MAP-001",
      "MOLIT-QUAL-MAP-001-P-MAPPEDQUALITYMETRIC-001",
      "MOLIT-QUAL-MAP-001-P-QUALITYLOSSDISPOSITION-001",
      "MOLIT-QUAL-MAP-001-P-SOURCEQUALITYELEMENT-001",
      "MOLIT-QUAL-MAP-LINK-001",
      "MOLIT-QUAL-MAP-LINK-001-P-DISPOSITION-001",
      "MOLIT-QUAL-MAP-LINK-001-P-METRIC-001",
      "MOLIT-QUAL-MEASURE-001-P-COMPUTEDON-001",
      "MOLIT-QUAL-MEASURE-001-P-ISMEASUREMENTOF-001",
      "MOLIT-QUAL-MEASURE-001-P-QUALITYRESULTCONCEPT-001",
      "MOLIT-QUAL-MEASURE-001-P-UNITMEASURE-001",
      "MOLIT-QUAL-MEASURE-001-P-VALUE-001",
      "MOLIT-QUAL-PROV-001",
      "MOLIT-QUAL-PROV-001-P-QUALITYEVALUATIONMETHOD-001",
      "MOLIT-QUAL-PROV-001-P-QUALITYEVALUATIONSCOPE-001",
      "MOLIT-QUAL-PROV-001-P-QUALITYMAPPINGSTATEMENT-001",
      "MOLIT-QUAL-PROV-001-P-QUALITYRESULTKIND-001",
      "MOLIT-QUAL-STATUS-001",
      "MOLIT-REC-001-P-LANGUAGE-001",
      "MOLIT-REC-001-P-MODIFIED-001",
      "MOLIT-REC-001-P-PRIMARYTOPIC-001",
      "MOLIT-REC-001-P-TITLE-001",
      "MOLIT-REC-DIST-001-P-CHECKSUM-001",
      "MOLIT-REC-DS-001-P-CONTACTPOINT-001",
      "MOLIT-REC-DS-001-P-PROVENANCE-001",
      "MOLIT-REC-QUAL-001-P-QUALIFICATIONEVIDENCE-001",
      "MOLIT-SVC-001-P-ENDPOINTURL-001",
      "MOLIT-SVC-001-P-SERVESDATASET-001",
      "MOLIT-SVC-001-P-THEME-001",
      "MOLIT-SVC-001-P-TITLE-001"
    ],
    "changed": [
      {
        "from": {
          "constraintCount": 1,
          "graphSha256": "e552b77da4c30ff8118fe84e1667dd9447712bed08b5bbeaf7d1d171fe5e74ff",
          "shapeFiles": [
            "shacl/molit-core.ttl"
          ]
        },
        "requirementId": "MOLIT-AGENT-001",
        "to": {
          "constraintCount": 1,
          "graphSha256": "277e49b232500d0fcee8a518c385fbbfdc67a64f3200be2dd024f11fff232659",
          "shapeFiles": [
            "shacl/molit-core.ttl"
          ]
        }
      },
      {
        "from": {
          "constraintCount": 1,
          "graphSha256": "f9cd073119d00bde9089e661fe48b445ae36c52f21df0e294451a071cb0b5e0c",
          "shapeFiles": [
            "shacl/molit-core.ttl"
          ]
        },
        "requirementId": "MOLIT-CAT-001",
        "to": {
          "constraintCount": 1,
          "graphSha256": "99e0c0ba2d2aad219864cdc5bffe80a7149e0ea43c67eccc645da48fbaed1dc1",
          "shapeFiles": [
            "shacl/molit-core.ttl"
          ]
        }
      },
      {
        "from": {
          "constraintCount": 1,
          "graphSha256": "db45ab07bfdbdc86569bf6493f6d05c3b4834a6dd2f36d949c365304fbfcb19a",
          "shapeFiles": [
            "shacl/molit-controlled-vocabularies.ttl"
          ]
        },
        "requirementId": "MOLIT-CV-CHECKSUM-001",
        "to": {
          "constraintCount": 1,
          "graphSha256": "19df03c8173e6def3bed7b925654ad4ed8b41e370bb6dc809863c1fd9320cbad",
          "shapeFiles": [
            "shacl/molit-controlled-vocabularies.ttl"
          ]
        }
      },
      {
        "from": {
          "constraintCount": 1,
          "graphSha256": "b4532d906d84b241b5efb34f3c4892ab3b1d5c8e0e218e94b796b136b9ca3340",
          "shapeFiles": [
            "shacl/molit-controlled-vocabularies.ttl"
          ]
        },
        "requirementId": "MOLIT-CV-MEDIATYPE-001",
        "to": {
          "constraintCount": 1,
          "graphSha256": "83bc3bb0a3f0eaf2150d1291cbcbd980901ac0be97648bb09a918cea3ea0ed30",
          "shapeFiles": [
            "shacl/molit-controlled-vocabularies.ttl"
          ]
        }
      },
      {
        "from": {
          "constraintCount": 1,
          "graphSha256": "cdadee477ff140d8ce923209b38fd52a7c8710ed5ddf50f2acd5b121f963d504",
          "shapeFiles": [
            "shacl/molit-core.ttl"
          ]
        },
        "requirementId": "MOLIT-DS-001",
        "to": {
          "constraintCount": 1,
          "graphSha256": "d5276ddea7ff083a0dd5e0c08983e3151f4833d8c283252f913f9f57af15f1ee",
          "shapeFiles": [
            "shacl/molit-core.ttl"
          ]
        }
      },
      {
        "from": {
          "constraintCount": 1,
          "graphSha256": "2fe2daf33d0fcb90e2192f529bb541fe3cc06e499a2589047ba664d0da3e56d3",
          "shapeFiles": [
            "shacl/molit-spatial.ttl"
          ]
        },
        "requirementId": "MOLIT-GEO-001",
        "to": {
          "constraintCount": 1,
          "graphSha256": "6b8510fb0fd0401c1fd8f1c783e1a7a32d3b02107495d9302647ca808d8cd3e8",
          "shapeFiles": [
            "shacl/molit-spatial.ttl"
          ]
        }
      },
      {